{
  "provider_id": "hugo",
  "provider_name": "Hugo",
  "category": "ssg",
  "tier_name": "Hugo - Ultra-Fast Static Site Generator",
  "description": "Ultra-fast static site generator built in Go, optimized for performance-critical sites with complex content relationships and technical documentation",
  "features": [
    "ultra_fast_builds",
    "go_based",
    "static_generation",
    "markdown_processing",
    "template_engine",
    "multilingual",
    "documentation_focused",
    "performance_optimization",
    "theme_support",
    "fast_builds"
  ],
  "supported_ssg_engines": [
    "hugo"
  ],
  "integration_modes": [
    "direct"
  ],
  "complexity_level": "advanced",
  "target_market": [
    "technical_users",
    "developer_teams",
    "performance_critical_sites",
    "documentation_sites",
    "technical_writers",
    "go_developers",
    "frontend_developers"
  ],
  "use_cases": [
    "Technical documentation sites with advanced navigation",
    "High-performance blog sites with technical focus",
    "Developer portfolio sites with project showcases",
    "Corporate websites requiring ultra-fast loading",
    "Documentation portals for API and technical manuals",
    "Multi-language websites with complex taxonomies"
  ],
  "cost_characteristics": {
    "base_tier": "free",
    "pricing_model": "free",
    "estimated_monthly_range": {
      "min": 0,
      "max": 0
    }
  },
  "technical_requirements": {
    "api_keys_required": false,
    "webhook_support": false,
    "custom_domain_support": true,
    "ssl_certificate_management": true
  },
  "performance_characteristics": {
    "build_time": "fast",
    "content_sync_speed": "instant",
    "cache_strategy": "advanced"
  },
  "implementation_class": "stacks.hosted_only.tier1.hugo_template_stack.HugoTemplateStack",
  "provider_class": "shared.ssg.engines.hugo.HugoConfig",
  "documentation": {
    "setup_guide": "https://gohugo.io/getting-started/",
    "api_reference": "https://gohugo.io/documentation/",
    "examples": "https://gohugo.io/showcase/"
  },
  "compatibility": {
    "ssg_engine_compatibility": {
      "hugo": {
        "compatibility_score": 10,
        "setup_complexity": "advanced",
        "special_features": [
          "ultra_fast_builds",
          "go_templating",
          "advanced_content_management",
          "complex_taxonomies",
          "multilingual_support",
          "shortcodes",
          "content_bundles"
        ],
        "limitations": [
          "Requires Go templating knowledge",
          "Learning curve for advanced features",
          "Limited JavaScript ecosystem integration"
        ]
      }
    }
  },
  "metadata_version": "1.0.0",
  "last_updated": "2025-01-13T15:30:00Z"
}